{
  "$schema": "https://json-schema.org/draft/2020-12/schema",
  "additionalProperties": false,
  "properties": {
    "contract_sha256": {
      "pattern": "^[a-f0-9]{64}$",
      "type": "string"
    },
    "dependency_0_sha256": {
      "pattern": "^[a-f0-9]{64}$",
      "type": "string"
    },
    "dependency_10_sha256": {
      "pattern": "^[a-f0-9]{64}$",
      "type": "string"
    },
    "dependency_11_sha256": {
      "pattern": "^[a-f0-9]{64}$",
      "type": "string"
    },
    "dependency_12_sha256": {
      "pattern": "^[a-f0-9]{64}$",
      "type": "string"
    },
    "dependency_13_sha256": {
      "pattern": "^[a-f0-9]{64}$",
      "type": "string"
    },
    "dependency_14_sha256": {
      "pattern": "^[a-f0-9]{64}$",
      "type": "string"
    },
    "dependency_15_sha256": {
      "pattern": "^[a-f0-9]{64}$",
      "type": "string"
    },
    "dependency_16_sha256": {
      "pattern": "^[a-f0-9]{64}$",
      "type": "string"
    },
    "dependency_1_sha256": {
      "pattern": "^[a-f0-9]{64}$",
      "type": "string"
    },
    "dependency_2_sha256": {
      "pattern": "^[a-f0-9]{64}$",
      "type": "string"
    },
    "dependency_3_sha256": {
      "pattern": "^[a-f0-9]{64}$",
      "type": "string"
    },
    "dependency_4_sha256": {
      "pattern": "^[a-f0-9]{64}$",
      "type": "string"
    },
    "dependency_5_sha256": {
      "pattern": "^[a-f0-9]{64}$",
      "type": "string"
    },
    "dependency_6_sha256": {
      "pattern": "^[a-f0-9]{64}$",
      "type": "string"
    },
    "dependency_7_sha256": {
      "pattern": "^[a-f0-9]{64}$",
      "type": "string"
    },
    "dependency_8_sha256": {
      "pattern": "^[a-f0-9]{64}$",
      "type": "string"
    },
    "dependency_9_sha256": {
      "pattern": "^[a-f0-9]{64}$",
      "type": "string"
    },
    "executor_sha256": {
      "pattern": "^[a-f0-9]{64}$",
      "type": "string"
    },
    "identity": {
      "const": "provider-neutral-runtime-parked-postdeploy-readonly-20261012-r1"
    },
    "plan_sha256": {
      "pattern": "^[a-f0-9]{64}$",
      "type": "string"
    },
    "prepared_commit_sha": {
      "pattern": "^[a-f0-9]{40}$",
      "type": "string"
    },
    "prerequisite_commit_sha": {
      "pattern": "^[a-f0-9]{40}$",
      "type": "string"
    },
    "prerequisite_executor_sha256": {
      "pattern": "^[a-f0-9]{64}$",
      "type": "string"
    },
    "prerequisite_plan_sha256": {
      "pattern": "^[a-f0-9]{64}$",
      "type": "string"
    },
    "prerequisite_run_id": {
      "minimum": 1,
      "type": "integer"
    },
    "prerequisite_schema_sha256": {
      "pattern": "^[a-f0-9]{64}$",
      "type": "string"
    },
    "prerequisite_workflow_sha256": {
      "pattern": "^[a-f0-9]{64}$",
      "type": "string"
    },
    "schema_sha256": {
      "pattern": "^[a-f0-9]{64}$",
      "type": "string"
    },
    "state": {
      "const": "CONSUMED_BEFORE_REMOTE"
    },
    "workflow_sha256": {
      "pattern": "^[a-f0-9]{64}$",
      "type": "string"
    }
  },
  "required": [
    "workflow_sha256",
    "executor_sha256",
    "plan_sha256",
    "schema_sha256",
    "contract_sha256",
    "dependency_0_sha256",
    "dependency_1_sha256",
    "dependency_2_sha256",
    "dependency_3_sha256",
    "dependency_4_sha256",
    "dependency_5_sha256",
    "dependency_6_sha256",
    "dependency_7_sha256",
    "dependency_8_sha256",
    "dependency_9_sha256",
    "dependency_10_sha256",
    "dependency_11_sha256",
    "dependency_12_sha256",
    "dependency_13_sha256",
    "dependency_14_sha256",
    "dependency_15_sha256",
    "dependency_16_sha256",
    "prerequisite_workflow_sha256",
    "prerequisite_executor_sha256",
    "prerequisite_plan_sha256",
    "prerequisite_schema_sha256",
    "identity",
    "state",
    "prepared_commit_sha",
    "prerequisite_commit_sha",
    "prerequisite_run_id"
  ],
  "type": "object"
}
