{
  "workflow_sha256": "b10a155d69fadc024653bd5bb9f14affe0b8aa5420295d7f1bd5e57b438d3127",
  "executor_sha256": "5a73cec93ade46738f288e1cde5dcf19c1919d0444a2cb6868f9413d8f878a35",
  "plan_sha256": "7008f85abb2d668d4244850241a9db90951836dd5fa0a36f826ad0b07a0b7906",
  "schema_sha256": "cd92be6f970d980695361b069dc2f8a65f84ed2b1a4908976c39e8939d73ceda",
  "contract_sha256": "c336c12c2e64c814972720012d7a79009e509d9a5de4d58b88b6ae26688d3c0d",
  "dependency_0_sha256": "56163be0825d3cc240e85eef8a757ee2a50a2ea92380979aa3fae81a8a9f795d",
  "dependency_1_sha256": "b96edafbbc0df5121eda655bd1fa12af6dc086f9b2077982410c97f740851985",
  "dependency_2_sha256": "4e5c746374757d77baf053c46c7516f65298f3cedbd8d37f6dea09242e619ee6",
  "dependency_3_sha256": "7c7f963852edeea87aac66d23da7779708bef21ede4272517fa32de7bf2331af",
  "dependency_4_sha256": "cc30881e25654885ff47013f0fef41dc2250cf2d3ec99f5fb597c335ca0ef66b",
  "dependency_5_sha256": "36200a1994e59ba12f7fec5daf1dff42286a0954f4628acb45f33c6061939f62",
  "dependency_6_sha256": "49ab6740b3c5852fb0a3353b93c248ce89b2b9b8833ff52507fd0671e745899b",
  "dependency_7_sha256": "3130c43646ad255a75f4c0c1a8c0407caf482a76f327508d65379546ffdf9a7d",
  "dependency_8_sha256": "8a6615fd020ca6590ba8f5e2c73a3844473d9e6ecd3babb19ea836d604d4a8a9",
  "dependency_9_sha256": "461f93e9d8468fd26f93895f7cbac002d5b49d35ff3eabe0a865e422226652eb",
  "dependency_10_sha256": "8315eac39526ed97126c3b5f85df9e150afc63186c224a3820fb03103bf11828",
  "dependency_11_sha256": "6c5d726f96d56dac792ff739f87227926197891f1149b1dedeeac38e67128451",
  "dependency_12_sha256": "44275c75b3c0b1f4ac13cf4d6e73ec591ffec6f5760f9900a8d56d8cccca8e2d",
  "dependency_13_sha256": "b51954cc2f6aae162849db7c4041837c9a064e24c1c25ae8f273852bc5d9a08a",
  "dependency_14_sha256": "7aee4bc42b39f96c698cc285de349dc07c3893329719d19e23be13140ba143c3",
  "dependency_15_sha256": "5fb7fe2a6afc882beef70db32211b62408fed96436cce4a606e62507d60a640e",
  "dependency_16_sha256": "cf4435afacafbde87bd1101525c9c795fb89ba52b45bb3846414d1c33463569a",
  "prerequisite_workflow_sha256": "596d10ed6770aaf58d954f4e9dcfe0b4906f0d758e8a6570f5bfbe396530ad19",
  "prerequisite_executor_sha256": "429463569f73e424b3dc09227f455959fd813d6901393375d165feef85169928",
  "prerequisite_plan_sha256": "00bf5015170541d3f99d3f1b9a39dce9babebb5987d24fb5b52cf1e1aee79d6b",
  "prerequisite_schema_sha256": "8e7f2e62ded95601e0c7eb56bc60ddedd1bfafb03c8881e89257d3673d09e623",
  "identity": "provider-neutral-runtime-parked-postdeploy-readonly-20261012-r1",
  "state": "CONSUMED_BEFORE_REMOTE",
  "prepared_commit_sha": "cb0da5ee4a89b71f7f1ed94e94f4c67c23fffb9a",
  "prerequisite_commit_sha": "53b840614e9c81baddbf05692a4cfa2301c036e8",
  "prerequisite_run_id": 38196111051
}
